ffff9fcd5ec6a900 734970765 S Bo:1:079:1 -115 4 = 810d01ff
ffff9fcd5ec6a900 734970853 C Bo:1:079:1 0 4 >
ffff9fcd5ec6a900 734970913 S Bi:1:079:1 -115 4 <
ffff9fcd5ec6a900 734984158 C Bi:1:079:1 0 4 = 820d01ff
ffff9fcd5ec6a900 738192878 S Bo:1:079:1 -115 4 = 810d0101
ffff9fcd5ec6a900 738192956 C Bo:1:079:1 0 4 >
ffff9fcd5ec6a900 738193009 S Bi:1:079:1 -115 10 <
ffff9fcd5ec6a900 738193178 C Bi:1:079:1 0 7 = 820d0402 080200
ffff9fcd5ec6a900 738193322 S Bo:1:079:1 -115 4 = 81ff0141
ffff9fcd5ec6a900 738193401 C Bo:1:079:1 0 4 >
ffff9fcd48de5600 738403379 C Ii:1:001:1 0:2048 2 = 0800
ffff9fcd48de5600 738403401 S Ii:1:001:1 -115:2048 4 <
ffff9fcdd4c4a780 738403427 S Ci:1:001:0 s a3 00 0000 0003 0004 4 <
ffff9fcdd4c4a780 738403482 C Ci:1:001:0 0 4 = 00010100
ffff9fcdd4c4a780 738403490 S Co:1:001:0 s 23 01 0010 0003 0000 0
ffff9fcdd4c4a780 738403511 C Co:1:001:0 0 0
ffff9fcdd4c4ac00 738405423 S Ci:1:001:0 s a3 00 0000 0003 0004 4 <
ffff9fcdd4c4ac00 738405456 C Ci:1:001:0 0 4 = 00010000
ffff9fcdd4c4a240 738431753 S Ci:1:001:0 s a3 00 0000 0003 0004 4 <
ffff9fcdd4c4a240 738431777 C Ci:1:001:0 0 4 = 00010000
ffff9fcdd4c4a240 738458722 S Ci:1:001:0 s a3 00 0000 0003 0004 4 <
ffff9fcdd4c4a240 738458746 C Ci:1:001:0 0 4 = 00010000
ffff9fcdd4c4a240 738485708 S Ci:1:001:0 s a3 00 0000 0003 0004 4 <
ffff9fcdd4c4a240 738485736 C Ci:1:001:0 0 4 = 00010000
ffff9fcdd4c4a240 738512732 S Ci:1:001:0 s a3 00 0000 0003 0004 4 <
ffff9fcdd4c4a240 738512771 C Ci:1:001:0 0 4 = 00010000
ffff9fcd48de5600 738512817 C Ii:1:001:1 -2:2048 0
ffff9fcdd4c4a240 739056636 S Ci:1:001:0 s a3 00 0000 0001 0004 4 <
ffff9fcdd4c4a240 739056798 C Ci:1:001:0 0 4 = 00010000
ffff9fcdd4c4a240 739056810 S Ci:1:001:0 s a3 00 0000 0002 0004 4 <
ffff9fcdd4c4a240 739056829 C Ci:1:001:0 0 4 = 00010000
ffff9fcdd4c4a240 739056835 S Ci:1:001:0 s a3 00 0000 0003 0004 4 <
ffff9fcdd4c4a240 739056851 C Ci:1:001:0 0 4 = 01010100
ffff9fcdd4c4a240 739056863 S Co:1:001:0 s 23 01 0010 0003 0000 0
ffff9fcdd4c4a240 739056883 C Co:1:001:0 0 0
ffff9fcdd4c4a240 739056897 S Ci:1:001:0 s a3 00 0000 0004 0004 4 <
ffff9fcdd4c4a240 739056923 C Ci:1:001:0 0 4 = 00010000
ffff9fcdd4c4a240 739056932 S Ci:1:001:0 s a3 00 0000 0005 0004 4 <
ffff9fcdd4c4a240 739056956 C Ci:1:001:0 0 4 = 00010000
ffff9fcdd4c4a240 739056968 S Ci:1:001:0 s a3 00 0000 0006 0004 4 <
ffff9fcdd4c4a240 739056991 C Ci:1:001:0 0 4 = 00010000
ffff9fcdd4c4a240 739057000 S Ci:1:001:0 s a3 00 0000 0007 0004 4 <
ffff9fcdd4c4a240 739057023 C Ci:1:001:0 0 4 = 00010000
ffff9fcdd4c4a240 739057034 S Ci:1:001:0 s a3 00 0000 0008 0004 4 <
ffff9fcdd4c4a240 739057065 C Ci:1:001:0 0 4 = 07050000
ffff9fcdd4c4a240 739057075 S Ci:1:001:0 s a3 00 0000 0009 0004 4 <
ffff9fcdd4c4a240 739057098 C Ci:1:001:0 0 4 = 07010000
ffff9fcdd4c4a240 739057108 S Ci:1:001:0 s a3 00 0000 000a 0004 4 <
ffff9fcdd4c4a240 739057131 C Ci:1:001:0 0 4 = 07010000
ffff9fcdd4c4a240 739057140 S Ci:1:001:0 s a3 00 0000 000b 0004 4 <
ffff9fcdd4c4a240 739057164 C Ci:1:001:0 0 4 = 00010000
ffff9fcdd4c4a240 739057171 S Ci:1:001:0 s a3 00 0000 000c 0004 4 <
ffff9fcdd4c4a240 739057195 C Ci:1:001:0 0 4 = 00010000
ffff9fcd48de5600 739158597 S Ii:1:001:1 -115:2048 4 <
ffff9fcdd4c4a240 739158614 S Ci:1:001:0 s a3 00 0000 0003 0004 4 <
ffff9fcdd4c4a240 739158643 C Ci:1:001:0 0 4 = 01010000
ffff9fcdd4c4a240 739158750 S Co:1:001:0 s 23 03 0004 0003 0000 0
ffff9fcdd4c4a240 739158780 C Co:1:001:0 0 0
ffff9fcdd4c4a240 739221664 S Ci:1:001:0 s a3 00 0000 0003 0004 4 <
ffff9fcdd4c4a240 739221697 C Ci:1:001:0 0 4 = 03011000
ffff9fcdd4c4a240 739221707 S Co:1:001:0 s 23 01 0014 0003 0000 0
ffff9fcdd4c4a240 739221729 C Co:1:001:0 0 0
ffff9fcdd4c4a240 739274890 S Ci:1:000:0 s 80 06 0100 0000 0040 64 <
ffff9fcdd4c4a240 739275032 C Ci:1:000:0 0 18 = 12010002 ef020140 861a1280 08020102 0301
ffff9fcdd4c4a240 739275056 S Co:1:001:0 s 23 03 0004 0003 0000 0
ffff9fcdd4c4a240 739275083 C Co:1:001:0 0 0
ffff9fcdd4c4a240 739336651 S Ci:1:001:0 s a3 00 0000 0003 0004 4 <
ffff9fcdd4c4a240 739336684 C Ci:1:001:0 0 4 = 03011000
ffff9fcdd4c4a240 739336694 S Co:1:001:0 s 23 01 0014 0003 0000 0
ffff9fcdd4c4a240 739336711 C Co:1:001:0 0 0
ffff9fcdd4c4a240 739400616 S Ci:1:080:0 s 80 06 0100 0000 0012 18 <
ffff9fcdd4c4a240 739400785 C Ci:1:080:0 0 18 = 12010002 ef020140 861a1280 08020102 0301
ffff9fcdd4c4a240 739400819 S Ci:1:080:0 s 80 06 0600 0000 000a 10 <
ffff9fcdd4c4a240 739401078 C Ci:1:080:0 -32 0
ffff9fcdd4c4a240 739401106 S Ci:1:080:0 s 80 06 0600 0000 000a 10 <
ffff9fcdd4c4a240 739401261 C Ci:1:080:0 -32 0
ffff9fcdd4c4a240 739401271 S Ci:1:080:0 s 80 06 0600 0000 000a 10 <
ffff9fcdd4c4a240 739401425 C Ci:1:080:0 -32 0
ffff9fcdd4c4a240 739401438 S Ci:1:080:0 s 80 06 0200 0000 0009 9 <
ffff9fcdd4c4a240 739401534 C Ci:1:080:0 0 9 = 09026200 03010080 fa
ffff9fcdd4c4a240 739401542 S Ci:1:080:0 s 80 06 0200 0000 0062 98 <
ffff9fcdd4c4a240 739401702 C Ci:1:080:0 0 98 = 09026200 03010080 fa090400 0002ff00 00040705 02024000 00070583 02400000
ffff9fcdd4c4a840 739401718 S Ci:1:080:0 s 80 06 0300 0000 00ff 255 <
ffff9fcdd4c4a840 739401828 C Ci:1:080:0 0 4 = 04030904
ffff9fcdd4c4a840 739401835 S Ci:1:080:0 s 80 06 0302 0409 00ff 255 <
ffff9fcdd4c4a840 739401954 C Ci:1:080:0 0 18 = 12035700 43004800 2d004c00 69006e00 6b00
ffff9fcdd4c4a840 739401962 S Ci:1:080:0 s 80 06 0301 0409 00ff 255 <
ffff9fcdd4c4a840 739402079 C Ci:1:080:0 0 14 = 0e037700 63006800 2e006300 6e00
ffff9fcdd4c4a840 739402087 S Ci:1:080:0 s 80 06 0303 0409 00ff 255 <
ffff9fcdd4c4a840 739402211 C Ci:1:080:0 0 26 = 1a034300 37004100 41003800 46003000 36003400 43003800 3500
ffff9fcdd4c4a840 739404802 S Co:1:080:0 s 00 09 0001 0000 0000 0
ffff9fcdd4c4a840 739404949 C Co:1:080:0 0 0
ffff9fcdd4c4a840 739405184 S Ci:1:080:0 s 80 06 0304 0409 00ff 255 <
ffff9fcdd4c4a840 739405339 C Ci:1:080:0 0 28 = 1c035700 43004800 20004300 4d005300 49005300 2d004400 41005000
ffff9fcf1c341b40 739406424 S Co:1:080:0 s 21 20 0000 0002 0007 7 = 80250000 000008
ffff9fcf1c341b40 739406537 C Co:1:080:0 0 7 >
