ffff9fcd45da6240 706500407 S Bo:1:078:2 -115 4 = 810d0101
ffff9fcd45da6240 706500542 C Bo:1:078:2 0 4 >
ffff9fcd45da6240 706500623 S Bi:1:078:3 -115 10 <
ffff9fcd45da6240 706500747 C Bi:1:078:3 0 7 = 820d0402 080201
ffff9fcd45da6240 706500936 S Bo:1:078:2 -115 4 = 81ff0152
ffff9fcd45da6240 706501055 C Bo:1:078:2 0 4 >
ffff9fcd48de5600 706710736 C Ii:1:001:1 0:2048 2 = 0800
ffff9fcd48de5600 706710760 S Ii:1:001:1 -115:2048 4 <
ffff9fcdd28026c0 706710787 S Ci:1:001:0 s a3 00 0000 0003 0004 4 <
ffff9fcdd28026c0 706710819 C Ci:1:001:0 0 4 = 00010100
ffff9fcdd28026c0 706710828 S Co:1:001:0 s 23 01 0010 0003 0000 0
ffff9fcdd28026c0 706710850 C Co:1:001:0 0 0
ffff9fcdd28026c0 706712637 S Ci:1:001:0 s a3 00 0000 0003 0004 4 <
ffff9fcdd28026c0 706712673 C Ci:1:001:0 0 4 = 00010000
ffff9fcdd2802cc0 706739645 S Ci:1:001:0 s a3 00 0000 0003 0004 4 <
ffff9fcdd2802cc0 706739672 C Ci:1:001:0 0 4 = 00010000
ffff9fcdd2802cc0 706766664 S Ci:1:001:0 s a3 00 0000 0003 0004 4 <
ffff9fcdd2802cc0 706766705 C Ci:1:001:0 0 4 = 00010000
ffff9fcdd2802cc0 706794602 S Ci:1:001:0 s a3 00 0000 0003 0004 4 <
ffff9fcdd2802cc0 706794638 C Ci:1:001:0 0 4 = 00010000
ffff9fcdd2802cc0 706821611 S Ci:1:001:0 s a3 00 0000 0003 0004 4 <
ffff9fcdd2802cc0 706821648 C Ci:1:001:0 0 4 = 00010000
ffff9fcd48de5600 706821679 C Ii:1:001:1 -2:2048 0
ffff9fcdd2802cc0 707364459 S Ci:1:001:0 s a3 00 0000 0001 0004 4 <
ffff9fcdd2802cc0 707364584 C Ci:1:001:0 0 4 = 00010000
ffff9fcdd2802cc0 707364649 S Ci:1:001:0 s a3 00 0000 0002 0004 4 <
ffff9fcdd2802cc0 707364670 C Ci:1:001:0 0 4 = 00010000
ffff9fcdd2802cc0 707364677 S Ci:1:001:0 s a3 00 0000 0003 0004 4 <
ffff9fcdd2802cc0 707364694 C Ci:1:001:0 0 4 = 01010100
ffff9fcdd2802cc0 707364700 S Co:1:001:0 s 23 01 0010 0003 0000 0
ffff9fcdd2802cc0 707364718 C Co:1:001:0 0 0
ffff9fcdd2802cc0 707364723 S Ci:1:001:0 s a3 00 0000 0004 0004 4 <
ffff9fcdd2802cc0 707364743 C Ci:1:001:0 0 4 = 00010000
ffff9fcdd2802cc0 707364750 S Ci:1:001:0 s a3 00 0000 0005 0004 4 <
ffff9fcdd2802cc0 707364771 C Ci:1:001:0 0 4 = 00010000
ffff9fcdd2802cc0 707364777 S Ci:1:001:0 s a3 00 0000 0006 0004 4 <
ffff9fcdd2802cc0 707364797 C Ci:1:001:0 0 4 = 00010000
ffff9fcdd2802cc0 707364804 S Ci:1:001:0 s a3 00 0000 0007 0004 4 <
ffff9fcdd2802cc0 707364824 C Ci:1:001:0 0 4 = 00010000
ffff9fcdd2802cc0 707364830 S Ci:1:001:0 s a3 00 0000 0008 0004 4 <
ffff9fcdd2802cc0 707364851 C Ci:1:001:0 0 4 = 07050000
ffff9fcdd2802cc0 707364858 S Ci:1:001:0 s a3 00 0000 0009 0004 4 <
ffff9fcdd2802cc0 707364878 C Ci:1:001:0 0 4 = 07010000
ffff9fcdd2802cc0 707364884 S Ci:1:001:0 s a3 00 0000 000a 0004 4 <
ffff9fcdd2802cc0 707364905 C Ci:1:001:0 0 4 = 07010000
ffff9fcdd2802cc0 707364911 S Ci:1:001:0 s a3 00 0000 000b 0004 4 <
ffff9fcdd2802cc0 707364931 C Ci:1:001:0 0 4 = 00010000
ffff9fcdd2802cc0 707364938 S Ci:1:001:0 s a3 00 0000 000c 0004 4 <
ffff9fcdd2802cc0 707364958 C Ci:1:001:0 0 4 = 00010000
ffff9fcd48de5600 707470651 S Ii:1:001:1 -115:2048 4 <
ffff9fcdd2802cc0 707470676 S Ci:1:001:0 s a3 00 0000 0003 0004 4 <
ffff9fcdd2802cc0 707470727 C Ci:1:001:0 0 4 = 01010000
ffff9fcdd2802cc0 707470869 S Co:1:001:0 s 23 03 0004 0003 0000 0
ffff9fcdd2802cc0 707470913 C Co:1:001:0 0 0
ffff9fcdd2802cc0 707532736 S Ci:1:001:0 s a3 00 0000 0003 0004 4 <
ffff9fcdd2802cc0 707532773 C Ci:1:001:0 0 4 = 03011000
ffff9fcdd2802cc0 707532800 S Co:1:001:0 s 23 01 0014 0003 0000 0
ffff9fcdd2802cc0 707532820 C Co:1:001:0 0 0
ffff9fcdd2802cc0 707584786 S Ci:1:000:0 s 80 06 0100 0000 0040 64 <
ffff9fcdd2802cc0 707584943 C Ci:1:000:0 0 18 = 12011001 ef020140 861a1080 08020102 0301
ffff9fcdd2802cc0 707584971 S Co:1:001:0 s 23 03 0004 0003 0000 0
ffff9fcdd2802cc0 707585001 C Co:1:001:0 0 0
ffff9fcdd2802cc0 707646605 S Ci:1:001:0 s a3 00 0000 0003 0004 4 <
ffff9fcdd2802cc0 707646641 C Ci:1:001:0 0 4 = 03011000
ffff9fcdd2802cc0 707646653 S Co:1:001:0 s 23 01 0014 0003 0000 0
ffff9fcdd2802cc0 707646671 C Co:1:001:0 0 0
ffff9fcdd2802cc0 707710722 S Ci:1:079:0 s 80 06 0100 0000 0012 18 <
ffff9fcdd2802cc0 707710894 C Ci:1:079:0 0 18 = 12011001 ef020140 861a1080 08020102 0301
ffff9fcdd2802cc0 707710935 S Ci:1:079:0 s 80 06 0200 0000 0009 9 <
ffff9fcdd2802cc0 707711088 C Ci:1:079:0 0 9 = 09027800 03010080 32
ffff9fcdd2802cc0 707711114 S Ci:1:079:0 s 80 06 0200 0000 0078 120 <
ffff9fcdd2802cc0 707711356 C Ci:1:079:0 0 120 = 09027800 03010080 32080b00 01ff0000 02090400 0004ff80 55000705 82024000
ffff9fcdd28020c0 707711390 S Ci:1:079:0 s 80 06 0300 0000 00ff 255 <
ffff9fcdd28020c0 707711507 C Ci:1:079:0 0 4 = 04030904
ffff9fcdd28020c0 707711516 S Ci:1:079:0 s 80 06 0302 0409 00ff 255 <
ffff9fcdd28020c0 707711600 C Ci:1:079:0 0 18 = 12035700 43004800 2d004c00 69006e00 6b00
ffff9fcdd28020c0 707711610 S Ci:1:079:0 s 80 06 0301 0409 00ff 255 <
ffff9fcdd28020c0 707711743 C Ci:1:079:0 0 14 = 0e037700 63006800 2e006300 6e00
ffff9fcdd28020c0 707711770 S Ci:1:079:0 s 80 06 0303 0409 00ff 255 <
ffff9fcdd28020c0 707711898 C Ci:1:079:0 0 26 = 1a034300 37004100 41003800 46003000 36003400 43003800 3500
ffff9fcdd28020c0 707715218 S Co:1:079:0 s 00 09 0001 0000 0000 0
ffff9fcdd28020c0 707715359 C Co:1:079:0 0 0
ffff9fcdd4c4a9c0 707716112 S Co:1:079:0 s 21 20 0000 0001 0007 7 = 80250000 000008
ffff9fcdd4c4a9c0 707716267 C Co:1:079:0 0 7 >
